text,sentiment_score
Walmart FY2023 ESG Highlights Introduction Opportunity Sustainability Community Ethics & Integrity 4 LEADERSHIP LETTERS A Message from our Chief Executive Officer,0.0
Walmart FY2023 ESG Highlights Introduction Opportunity Sustainability Community Ethics & Integrity 5 LEADERSHIP LETTERS A Message from our Chief Sustainability Officer,0.0
Walmart FY2023 ESG Highlights Awards & Recognition #3 Fortune Change the World Listed on the 2023 Bloomberg Gender Equality Index #1 100% retailer in the EPA's Green Power Partnership rankings 2022 Disability Equality Index For seventh consecutive year For eighth consecutive year Introduction Opportunity Sustainability Community Ethics & Integrity 6 #17 One of America's Top Corporations for Women's Business Enterprises - from the Women's Business Enterprise National Council 2023 DiversityInc Top 50 Companies for Diversity 100% on the 2022 Human Rights Campaign's Corporate Equality Index #1 in National Truck Safety by the American Trucking Association Great Place to Work Certified Walmart Inc. and Sam's Club (2023),0.2285714285714286
"Walmart FY2023 ESG Highlights Our Company Walmart is a people-led, tech-powered omni-channel retailer dedicated to helping people save money and live better - anytime and anywhere - by providing the opportunity to shop in both retail stores and through eCommerce, and to access our other service offerings. Through innovation, we strive to continuously improve a customer-centric experience that seamlessly integrates our eCommerce and retail stores in an omni-channel offering that saves time for our customers. Our strategy is to bring our purpose to life, which means making every day easier for busy families, operating with discipline, sharpening our culture, becoming more digital, and making trust a competitive advantage. We are committed to doing this in a way that is regenerative - helping to renew people and the planet through our business. OUR BUSINESS IN FY2023 Omni-channel retailer serving approximately 240 million customers per week ~2.1 million associates 10,500 stores and eCommerce websites in 20 countries OUR VALUES Respect for the Individual Service to the Customer Strive for Excellence Act with Integrity S $611 billion in revenue Introduction Opportunity Sustainability Community Ethics & Integrity 7 HOW WALMART CREATES VALUE FOR STAKEHOLDERS · Communities: Resources to build stronger, more inclusive communities . Planet: Leadership on zero emissions, zero waste and our regenerative approach to nature · Customers: Convenient access to quality, affordable products and services · Associates: Purpose-driven work; opportunity for good jobs and upward mobility · Shareholders: Strong long-term returns through financial and ESG leadership · Suppliers: Access to customers and support for supplier development and growth . Business Partners: Access to and understanding of engaged customers for our sellers, advertisers, and ecosystem partners",0.17964646464646464
"Walmart FY2023 ESG Highlights alman vers t.com Introduction Opportunity Sustainability Community OUR APPROACH TO ESG Creating Shared Value Shared value - addressing societal issues in ways that create value for our business and stakeholders - lies at the heart of Walmart's enterprise strategy and our approach to ESG issues. We believe we maximize long-term value for shareholders by serving our stakeholders: our customers, associates, suppliers, business partners, communities, and even the planet. Addressing such societal needs builds the value of our business and as business strengthens society, society strengthens business. We aspire to become a regenerative company - helping to renew people and the planet through our business. Each of our ESG priority issue areas offers a discrete shared value proposition: an opportunity to meet a societal need through our business. Doing so aligns our business objectives with societal objectives and increases our ability to create value for the long term. Read more: Our ESG Priorities Ethics & Integrity 8 Management of ESG Leadership of ESG issues starts with our CEO - with oversight from our Board of Directors - and cascades across our enterprise. The Board's Nominating & Governance Committee (NGC) exercises oversight over Walmart's overall ESG strategy and certain priority issues, while other Board committees retain oversight over specific ESG issues. Walmart's Chief Sustainability Officer (CSO) helps define the ESG agenda and provides dedicated management and oversight of Walmart's global ESG initiatives and goals. The CSO provides updates to the Walmart executive leadership team and NGC. We have additional governance bodies at the management level, including the ESG Steering Committee and the ESG Disclosure Committee that help guide ESG strategy and disclosure. Read more: ESG Oversight and Management and Corporate Governance ESG Brief",0.09494047619047619
"Walmart FY2023 ESG Highlights OUR APPROACH TO ESG Our ESG Priorities We prioritize the ESG issues that offer the greatest potential for Walmart to create shared value; these are issues that rank high in relevance to our business and stakeholders as well as Walmart's ability to make a difference. For each priority ESG issue, our disclosures aim to: · Articulate the relevance of the issue for societyand Walmart's business · Reflect an understanding of stakeholder expectations · Share our aspirations, goals, and strategies to create shared value · Describe our progress, opportunities, and challenges Read more: Our ESG Priorities Introduction Opportunity Sustainability Community Ethics & Integrity Opportunity · Good jobs and advancement for associates · Equity and inclusion at Walmart and beyond · Growth for suppliers, sellers, and local economies Sustainability · Climate and renewable energy leadership · Zero waste in operations, products, and packaging · Regeneration of natural resources: forests, land, and oceans Community C · Serving communities · Access to safer, healthier food, products, and services · Disaster preparedness and response Ethics & Integrity · Highest ethical and compliance standards · Strong corporate governance · Engagement in public policy · Digital citizenship · Respect for human rights 9 Stakeholder Engagement Our ability to create shared value depends on direct and frequent engagement with our customers, associates, and community leaders, as well as the people who supply our products, hold our stock, and evaluate our performance. Stakeholder perspectives and feedback help improve the relevance and effectiveness of the products and services we offer and the initiatives we support. Day to day, we engage with customers, fellow associates, suppliers, members of the communities where we operate, and shareholders. Additionally, our 2021 ESG priority assessment included extensive outreach to stakeholders, including customers, associates, shareholders, suppliers, and NGOs, to understand their perspectives on which issues Walmart should prioritize. Read more: Stakeholder Engagement",0.14701754385964913
"FY2023 ESG Highlights Walmart Opportunity Retail can be a powerful engine for inclusive economic opportunity. We aim to advance equity and opportunity throughout Walmart, our product supply chain, and local communities to fulfill our customer mission, strengthen our business, and help people build a better life for themselves and their families. - RELATED ESG ISSUE BRIEFS: E Human Capital: Good Jobs & Advancement for Associates E Equity & Inclusion at Walmart & Beyond Supplier Opportunity",0.24285714285714285
"Walmart FY2023 ESG Highlights Introduction Opportunity Sustainability Community Ethics & Integrity Opportunity Highlights 11 68% $ 47 BILLION $21.75 U.S. associate average total hourly compensation1 full-time U.S. hourly associates2 37% of U.S. officers are women 28% of U.S. officers are people of color >34,000 ASSOCIATES enrolled in Live Better U >180,000 U.S. ASSOCIATES received promotions; 88% of roles4 above entry level filled internally cumulative total purchases supporting American jobs (2021 through FY2023) >$13 BILLION sourced from ~2,400 diverse suppliers5 to U.S. businesses",0.11363636363636362
"FY2023 ESG Highlights Walmart Introduction Opportunity Sustainability Community Ethics & Integrity 12 Human Capital: Good Jobs & Advancement for Associates Our aspiration: making retail a place of inclusive and equitable opportunity where people can gain skills and experience to advance their careers STRATEGY · Continued investment in wages (+54% in the average hourly wage since 2015) and benefits, increasing average total compensation to >$21.75/hour, and enhancing parental leave and family- building benefits · Enhanced engagement capabilities, including through digital Engagement Pulse Surveys and the MyFeedback portal · Connected U.S. frontline associates to career paths, with 88%6 of roles above entry level filled internally and >180,000 promotions7 Associate Listening and Feedback As Walmart associates, engaging and listening to each other has been core to our culture since our founding more than 60 years ago. As the world becomes more digital, it creates additional opportunities to solicit feedback from and respond to each other. In FY2023, Walmart U.S. introduced the Engagement Pulse Survey, a monthly survey administered to over one million Walmart U.S. frontline associates via the Me@Walmart app that helps leaders improve engagement, retention, and the overall associate experience. Additionally, our Associate Engagement Survey now provides the opportunity to submit open-text feedback, and more than 500,000 associates did so during our 2022 survey. U.S .- based associates can also utilize the MyFeedback Portal, which was designed and launched as a digital, intuitive, self-service site. Hundreds of associates utilize this channel each month. Feedback results are provided to leaders to create action plans and inform enhancements to our overall associate value proposition and ways of working. In FY2023, for example, benefits, training, and education enhancements were made because of associate feedback. AVERAGE HOURLY WAGE AND TOTAL COMPENSATION (END OF FY2023)8 See our Human Capital ESG brief for more information",0.11600000000000002
"Walmart FY2023 ESG Highlights Introduction Opportunity Sustainability 66 All of my dreams were coming true. I was ready for the next step of my career. HUMAN CAPITAL SPOTLIGHT Community Ethics & Integrity 13 Career Growth Through Live Better U - JARRYN ROBERTSON, PROJECT ANALYST Jarryn Robertson joined Walmart in 2009 as a part-time cash office associate at Store 1196 in New Roads, Louisiana, before transferring to work in asset protection in a supercenter and then a distribution center. Prior to working at Walmart, she'd wanted to get a college degree and had taken classes on and off after high school but never finished. Time, money, and a lack of direction had gotten in the way. In 2018 she heard about a new program Walmart was launching - Live Better U. She took advantage of the new, exciting opportunity and enrolled at Bellevue University, ultimately graduating with a business degree in December 2021. her skills and determination through rotations with several Home Office teams. Her hard work paid off: Jarryn was offered - and accepted - a job as a project analyst on the Non-Traditional Talent Pathways Team at the Home Office in Bentonville, Arkansas. ""When I received the job offer, I started to cry,"" she recalls. ""All of my dreams were coming true. I was ready for the next step of my career."" LIVE BETTER U Shortly after graduating, Jarryn learned about the Home Office Pathway Experience, a new program designed to connect frontline associates who are recent or soon-to-be college graduates with Home Office roles. Once Jarryn was accepted into the Home Office Pathway Experience program in early 2022, she worked hard to show Jarryn's story is just one of the thousands of stories of associates who have completed Live Better U programs, opening up new pathways to career progression and promotion at Walmart. The education and skills gained through Live Better U have propelled many associates to grow their careers at Walmart.",0.15706773618538325
"FY2023 ESG Highlights Walmart Introduction Equity & Inclusion at Walmart & Beyond Our aspiration: to advance equity and inclusion in our business, with our suppliers and business partners, and in the communities we serve STRATEGY · Create a culture of belonging, where all associates feel accepted and valued for their unique identities and skills · Promote inclusion through our sourcing of products, services, and goods not for resale; marketing; and business relationships · Advance equity and inclusion in society through business initiatives and complementary philanthropy FY2023 HIGHLIGHTS · Diversified recruiting and talent pools, including our frontline hourly associate base and strategic partnerships with HBCUs; people of color represent 41% of management (vs. 39% in FY2022) · Worked with more than 200 diverse creators and brands in marketing and sourced more than $13 billion from diverse suppliers . Granted $58 million towards our $100 million Center for Racial Equity commitment to address disparities in the U.S. criminal justice, education, finance, and health systems, with an additional $7 million contributed towards racial solidarity efforts Opportunity Sustainability Community Ethics & Integrity 14 Belonging at Walmart Walmart's diversity, equity, and inclusion efforts focus on creating a culture of belonging, where people can bring their best selves to work - and we can attract and retain talent to serve our customer well. Our efforts include removing barriers to hiring and advancement; training and education; associate resource groups; and robust oversight and reporting. This year, we began seeking to measure a sense of belonging through our Associate Engagement Survey. We also hired our first Chief Belonging Officer - an evolution of the Chief Diversity Officer role - in early FY2024. See our Equity & Inclusion ESG brief for more information",0.17500000000000002
"FY2023 ESG Highlights Walmart Supplier Opportunity Our aspiration: we aim to create economic opportunities for our suppliers, the people they employ, and their communities STRATEGY · Support the creation of American jobs by increasing our sourcing of products made, grown, or assembled in the U.S. · Source from and build capacity of diverse suppliers · Promote the production of goods in India for export · Support smallholder farmers and small producers through sourcing and capacity building FY2023 HIGHLIGHTS · Spent an incremental $47 billion on products supporting American jobs (2021 through end of FY2023) · Sourced more than $13 billion from ~2,400 diverse suppliers to our U.S. businesses · Invested >$39 million grants in smallholder capacity building in India15 and progressed against a commitment made to triple exports of goods from India to $10 billion by 2027 Introduction Opportunity Sustainability Supporting American Manufacturing Walmart has long supported American manufacturing and the creation of jobs in the U.S., completing a commitment to purchase an incremental $250 billion in products made, grown, or assembled in the U.S. in FY2023. Anticipating the successful completion of this commitment, Walmart renewed its commitment in 2021 and expanded its incremental spend goal to $350 billion over ten years. As of the end of FY2023, Walmart has already Community Ethics & Integrity 15 purchased an incremental $47 billion towards that new goal. Our sourcing can have a profound impact on local communities: we expect our new commitment to catalyze the creation of more than 750,000 new jobs across the U.S. As just one example, longtime Walmart Supplier Classic Fashion announced a new California cut- and-sew apparel facility in October 2022, which is expected to create 125 jobs by 2023 and an additional 225 jobs over five years. See our Supplier Opportunity ESG brief for more information",0.1352272727272727
"FY2023 ESG Highlights Walmart Sustainability Walmart seeks to transform our business and product supply chains to be regenerative - optimizing outcomes for climate, waste, nature, and people as we serve our customers and grow our business. RELATED ESG ISSUE BRIEFS: E Product Supply Chain Sustainability F Climate Change Regeneration of Natural Resources: Forests, Land, Oceans E E Waste: Circular Economy E People in Supply Chains",-0.07500000000000001
"Walmart FY2023 ESG Highlights Sustainability Highlights >750 MILLION MT CO2e reduced or avoided by suppliers since 201716 23.2% reduction in combined Scope 1 & 2 emissions vs. 2015 baseline17 (through 2021) >2 MILLION ACRES OF LAND conserved through Acres for America since 2005 Introduction Sustainability Opportunity Community Ethics & Integrity 17 63% >400 SUPPLIERS of global private-brand packaging is recyclable, reusable, or industrially compostable, a 5% increase over FY2022 set goals and/or reported progress on responsible recruitment through Walmart's Supplier Leadership Program on People",0.1
"FY2023 ESG Highlights Walmart Product Supply Chain Sustainability Our aspiration: accelerate progress on the sustainability of our own assortment and product supply chains across the retail and consumer goods industry STRATEGY · Set standards and requirements for product sourcing · Engage and support suppliers to pursue social and environmental initiatives · Lead consortia to accelerate collective action beyond Walmart · Help customers make informed choices through labeling and cause campaigns · Advocate for public policies that align with sustainable supply chain priorities · Accelerate systems change beyond Walmart through philanthropic investments FY2023 HIGHLIGHTS · Achieved at least 95% ""more sustainable"" certification for several commodities, including fresh and frozen seafood,19 bananas,20 coffee,21 and tea22 · Offered products that meet trusted standards for personal well-being, our communities and the environment through the Built for Better online shop . Relaunched Member's Mark brand - ""Made with Our Member and Planet in Mind"" · Made steady progress across food, apparel, consumables, and general merchandise across climate, waste, nature, and people strategies Introduction Opportunity Sustainability Community Ethics & Integrity 18 20x2025 SUSTAINABLE COMMODITIES In 2016, Walmart announced ""20x25"": a goal to source at least 20 agricultural commodities more sustainably by 2025. Since then, we have been working on the following: Our approach to more sustainably sourcing these commodities · Encouraging our suppliers to adopt more sustainable sourcing practices, including through product specifications and sourcing policies, as well as positions and policy statements . Revamping sourcing specifications and requiring certifications where available and aligned with our aspirations · Collaborating with suppliers, other retailers, NGOs, and others to improve practices across the sector · Asking suppliers to measure and report against progress · Supporting place-based sourcing in critical ecosystems · Measuring and reporting transparently See our Product Supply Chain Sustainability ESG brief for more information",0.165625
"Walmart FY2023 ESG Highlights Introduction Opportunity Sustainability Climate Change Our aspiration: we aim to galvanize collective action across the retail and consumer goods sector through advocacy, supplier engagement, philanthropy, and innovation in product supply chain practices while taking steps to strengthen the resilience of our business against the effects of climate change STRATEGY EV Fast Charging Network We are investing in clean energy infrastructure in the U.S. to make electric vehicle (EV) ownership more accessible, reliable, convenient, and affordable for our customers. By 2030, we intend to build out our EV fast-charging network to at least 10,000 chargers across 2,500+ Walmart and Sam's Club locations in the U.S., expanding on the EV fast-charging stations that are already available at over 280 locations across the U.S. Community Ethics & Integrity 19 ANNUAL GHG EMISSIONS Walmart's Progress on Operational Emissions (Scope 1 and 2)27 20 6.08 6.71 6.67 15 6.15 6.85 725 13.84 Millions Metric Tons (MMT] COJe 12.76 12.30 11.41 10.35 8.6 10 FY2023 HIGHLIGHTS PROJECT GIGATON: >750 MMT CO2e REDUCED TO DATE28 · Decreased our combined Scope 1 and 2 emissions23 by 23.2% (through 2021) · Increased percentage of electricity supplied by renewable sources to 46% (through 2021)24 · Increased supplier participation in Project Gigaton to ~75% of U.S. product net sales25 · Achieved >750MMT CO2e reduced, avoided, or sequestered through Project Gigaton26 · Advocated for climate-related policy in line with our Statement on Climate Policy including supporting the climate provisions of the Inflation Reduction Act 0 - (35) - (58) -200 Million Metric Tons (MMT) CO2e -400 (136) 737 6.62 0 CY2015 CY2016 CY2017 CY2018 CY2019 CY2020 CY2021 Scope 1 Scope 2 (market-based) (186) (158) -600 (176) -800 CY2018 CY2019 CY2020 CY2021 CY2022 CY2023 Cumulative emissions reduced, avoided, or sequestered (MMT CO2e) See our Climate Change ESG brief for more information",0.16597222222222222
"Walmart FY2023 ESG Highlights Introduction CLIMATE CHANGE SPOTLIGHT Project Gigaton: Transforming Supply Chains Walmart launched Project Gigaton in 2017 as an ambitious initiative to catalyze decarbonization in product value chains through engagement of suppliers, NGOs, and other stakeholders. Our goal: to democratize climate action and help reduce or avoid one billion metric tons (a ""gigaton"") of greenhouse gas emissions by 2030. Through Project Gigaton, we encourage suppliers to take action in six action areas that are key to decarbonization and relevant to our suppliers' businesses. PROJECT GIGATON PILLARS Over the past six years, we have expanded and deepened our work by adding new tools, resources, and other opportunities for suppliers to accelerate engagement and impact. For example, as part of Project Gigaton, Walmart collaborated with Schneider Electric to provide access to accelerators like Gigaton PPA, which offers suppliers the opportunity to participate in aggregate, utility-scale power purchase agreements. We also worked with CDP and HSBC to launch the Sustainable Supply Chain Finance Program, an early-payment program for suppliers who set science-based targets through Project Gigaton or have achieved certain score thresholds from CDP. As Project Gigaton continues to make progress across areas of the supply chain critical to decarbonization, Walmart is focused on increasing supplier engagement and ambition and catalyzing positive action. Energy · Gigaton PPA · Tools and playbooks Nature . Forums and summits · Place-based initiative connectors Waste · 10x20x30 initiative · Investing in technical assistance Sustainability Opportunity Packaging · Forums and summits · Sustainable packaging playbook Transportation · Collaborating on public policy · Sharing resources Product Use & Design · Investing in technical assistance · Golden design rules Community Ethics & Integrity 20 >750 MILLION MT CO2e reduced or avoided by suppliers since 201729 >5,200 SUPPLIERS signed up for Project Gigaton",0.06639610389610391
"FY2023 ESG Highlights Walmart Introduction Opportunity Sustainability Community Ethics & Integrity 21 Regeneration of Natural Resources: Forests, Land, Oceans Our aspiration: to place nature in the center of our business practices, including by protecting, more sustainably managing, or restoring at least 50 million acres of land and 1 million square miles of ocean by 2030 STRATEGY · Govern our nature strategy through accountable leadership · Identify nature-related dependencies, impacts, risks, and opportunities · Foster more sustainable production of commodities · Transition our operations toward regenerative practices · Support conservation and restoration of critical ecosystems · Encourage the development of place-based initiatives · Advocate for and invest in enablers of systemic change FY2023 HIGHLIGHTS · Engaged through business or philanthropy in efforts to protect, more sustainably manage, or restore >30 million acres of land and >1.4 million square miles of ocean · Pursued seven place-based commodity sourcing initiatives (e.g., rice, tuna) · Launched a nature portal to connect suppliers to information regarding place-based commodity sourcing and conservation opportunities · Reached a milestone of over two million acres conserved through the Acres for America program since 2005 Place-Based Sourcing We support the development of place-based and jurisdictional initiatives, which aim to create shared value for producers, suppliers, and communities across a landscape or seascape. For example, we partnered with The Nature Conservancy and the government of the Republic of the Marshall Islands to source tuna certified to Marine Stewardship Council standards for our Great Value brand. The initiative aspires to distribute at least 40% of net income to directly support community-based conservation and climate resilience projects including the development and management of Marine Protected Areas and coral reef restoration. We also collaborate with Indigo Ag to source Great Value rice from a place-based initiative in Arkansas. Rice farmers enrolled in the project implement on-farm practices that are intended to improve water and land stewardship, including crop rotation from legumes, fertilizer management, zero-grade rice production, multiple-inlet irrigation with computerized holes election, and furrow irrigation. See our Regeneration of Natural Resources ESG brief for more information",0.21333333333333335
