text,sentiment_score
"PERFORMANCE SUMMARY OUR ESG STRATEGY GOVERNANCE ESG DATA ENVIRONMENT RESPONSIBLE SOURCING CONTINUED Over the past year, we have continued to work hard with Fairtrade and our supplier partners to secure the future sourcing of Fairtrade tea from Assam. Due to unique challenges in the region, we are working together on an innovative new regional approach in Assam that provides a pathway towards certification and the long-term supply of Fairtrade tea. This means we remain dedicated to paying the Fairtrade Premium and Minimum Price as part of our commitment to a fair future for workers in Assam, the supply of this core ingredient, and our 100% Fairtrade tea commitment. The EU Deforestation Regulation comes into effect this year (with the draft UK Forest Risk Commodities legislation to be determined), which will drive the requirement for market- wide solutions to sourcing zero- deforestation commodities and support us in achieving our targets. For soy, we are continuing to collaborate with industry groups to advocate for market-level solutions to deliver higher volumes of vDCF soy to the UK. We are also committed to maintaining all of the palm oil and palm-based ingredients in our own-brand food products certified to sustainable standards set by the RSPO. For the 2% mass balance palm oil derivatives in our supply chain, we are working with our supply chain partners and multi-stakeholder organisations such as the Retail Palm Oil Group and the UK Sustainable Commodities Initiative to develop collective solutions to increase the availability of RSPO-segregated palm derivatives. LOW-IMPACT FARMING NET ZERO We support all our farmers, particularly British farmers, to grow lower-carbon and responsibly produced food, using less pesticide with fewer types, enhance their soil health and fertility, protect natural resources and drive innovation. LOTS DONE - PROGRESS FOR 2023/24 Supporting British farming Over 70% of the emissions in our Food business come from primary agriculture and of these emissions, the majority come from the production of meat. Partnering with over 16,000 M&S Select Farmers to help them reduce their environmental impact and increase their resilience in the face of increasing climate-related challenges is a priority. There is growing acknowledgement of the role that animals can play in ""regenerative"" farming systems and in restoring soil health. Our approach is to decarbonise our meat and milk through working with our UK farmers on new production models and driving on-farm innovation. Our Pathway Beef, for example, already has a carbon footprint 40% lower than the UK's average and we have developed plans with our suppliers to reduce carbon right across our meat supply chain. Farming with Nature Biodiversity is vital for productive and resilient farming systems, and we cannot deliver net zero without it. Our Farming with Nature programme supports the uptake of nature-friendly farming practices, and long-term climate resilience across all of our British grower base, protecting and enhancing 10,000 hectares of habitat for wildlife. SOCIAL Since 2021 we have partnered with LEAF (Linking Environment and Farming) to help us deliver our Farming with Nature standards: we require all of our British growers to be LEAF (Linking Environment and Farming) Marque certified, plus complete two additional M&S-specific modules, focused on landscape & nature and integrated pest management. Uptake of our modules has been strong: our British Select Farmers have met the majority of the practices (90% of landscape and nature and 88% of integrated pest management practices) in 2023/24. One example of the high standards our growers meet is all our growers set aside on average 8% of their land to wildlife. This year we were pleased to have received recognition from the 2023 WWF Basket assessment; M&S was the only retailer to score 100% against the robust environmental schemes metric for our Farming with Nature standards. This year we started to scale successful interventions and biodiversity and soil measurement technologies from the five science-based biodiversity monitoring trials we have been working on in partnership with the Game and Wildlife Conservation Trust and Fera Science. This included funding and implementing Agrisound sensors across 18 farms, covering 120 habitats and over 1,000 hectares. The sensors use acoustic technology to measure pollinator abundance and support growers to deliver interventions to increase pollinator numbers. C Producing delicious M&S quality products in nature friendly ways - three years of M&S' leading Farming with Nature programme BAKING WITH Wildfarmed We have deepened our collaboration with Wildfarmed, a pioneering regenerative farming and food partner, which aims to restore biodiversity, soil health and ecosystem balance through its Regenerative Standards that ensure practices without pesticides, herbicides, or fungicides. In 2023, we featured Wildfarmed regenerative flour in our top-performing in-store bakery range as part of our Farm to Foodhall campaign endorsed by chef Tom Kerridge. Since our partnership with Wildfarmed started in 2022, over three million loaves of the M&S Collection sourdough using Wildfarmed regenerative flour have been sold. C Wildfarmed and M&S build on relationship as regenerative flour is baked into leading product-range and championed in retailer's Farm to Foodhall campaign CHARTED SOURDOUGH Marks and Spencer Group plc ESG Report 2024 16",0.11748313701802071
"PERFORMANCE SUMMARY OUR ESG STRATEGY ENVIRONMENT GOVERNANCE ESG DATA SOCIAL RESPONSIBLE SOURCING CONTINUED Water With a significant reliance on water in horticultural production systems and increasingly extreme weather patterns, water management is firmly on our agenda. In 2023, we funded a series of events on integrated approaches to water management for our UK grower groups, as well as the role of nature-based solutions, including speakers from partner organisations, research groups and farm businesses. This year we also started funding the Alliance for Water Stewardship (AWS) Impact Accelerator in Huelva in Southern Spain, an important soft fruit growing region and home to the World Heritage site Doñana wetlands, which is under threat from drought and water use. The project will equip our suppliers with the knowledge, skills and networks they need to better understand their own water use and impacts, and work together to solve shared water challenges. M&S plays a leading role in cross-sector engagement on nature and water-related challenges through the Courtauld Commitment 2030 Water Ambition, which aims to help the UK food and drink sector improve the quality and availability of water across the 20 most important product- and ingredient-sourcing regions. As signatories we have committed to a shared goal of sourcing 50% of fresh food from areas of sustainable water management by 2030. In 2023/24, we provided additional funding for the Courtauld 2030 Water Roadmap and are now funding six water stewardship projects in the highest-risk regions across the UK, Southern Spain, Kenya, South Africa and Peru. FARM OF THE Future In 2023, we launched our Farm of the Future Programme, which aims to support livestock farmers to rapidly decarbonise and adopt sustainable practices, together with Harper Adams University's School of Sustainable Food and Farming. We are working with seven M&S Select Farms across six key production sectors to identify and implement practical activities to help them achieve net zero and maximise wildlife and habitat creation. The seven-year programme will also show where we need to change or adapt existing practices to drive sustainability. We believe that Farm of the Future will support innovative approaches in sustainable farming, and we will share knowledge across M&S Select Farms and the wider industry to drive sustainable change. We are delivering Farm of the Future in collaboration with Cranswick, Skea Eggs, Dunbia, Scotbeef, Linden Foods, Müller and 2 Sisters Food Group. C News - M&S launches collaborative Farm of the Future Programme in drive to help farms achieve Net Zero LOTS TO DO, LOTS OF OPPORTUNITY - FOCUS FOR 2024/25 Our priorities for 2024/25 include managing soils to develop resilient production, and using data collected through the Farming with Nature Programme to gain knowledge of the carbon benefits and nature-related risks and impacts. We source as much as we can from the UK; where we source from overseas, we ensure the best quality products. We are committed to working in partnership with fresh produce growers overseas to support their resilience to climate change and product quality, and tackle water stress, carbon reduction and biodiversity loss. Over the next two years, we will establish robust environmental standards (such as LEAF Marque and Global GAP Sustainable Programme for Irrigation and Groundwater use certification), along with innovation and support programmes for our highest-risk overseas sourcing countries. Marks and Spencer Group plc ESG Report 2024 17",0.17528735632183906
"OUR ESG STRATEGY ENVIRONMENT GOVERNANCE ESG DATA PERFORMANCE SUMMARY RESPONSIBLE SOURCING CONTINUED CLOTHING & HOME LOTS DONE - PROGRESS FOR 2023/24 C&H 31% of our total Scope 3 emissions come from products we sell in Clothing & Home. Our choice of fibres and how they are sourced are important and the production and initial transformation stages of our raw materials makes up around half of the Clothing & Home product emissions. This year we made progress, moving from 68% to 76% for responsibly sourced fibres. While we did a lot of this through our in-house expertise, our supply chain is global and very complex, so we work with partners, such as Textile Exchange (a global non-profit who aim to drive impact through the fashion, textile and apparel industry) and the CanopyStyle initiative, (who work with fashion brands, retailers, designers and viscose producers to protect ancient and endangered forests) to incorporate best sustainable practices in the fashion and textile industries. Our focus for sustainable raw materials is on our core materials: cotton, MMCF and polyester, which together represent more than 80% of our fibre mix. The preferred raw material alternatives have a lower environmental impact than their traditional equivalents and consider various aspects of sustainability (such as farming practices, renewable resources use and deforestation risk) based on industry-recognised data. Our Sustainability Academy supports colleagues to drive change through raw material selection. SOCIAL Cotton Over half of our raw materials mix is cotton. Since 2019, we have sourced all of the cotton in our clothing through Better Cotton, organic- or recycled-certified. In 2023/24 we continued to convert cotton in our homeware products, making significant progress and are now at 93%. We are confident that we will meet our 100% cotton target across Clothing & Home by 2025/26. Read more on our website Polyester We are really proud that in 2023 we achieved a significant milestone of 70%1 verified recycled polyester and based on the progress made across 2023/24, we are on track to achieve 100% by the end of 2025/26. Man-Made Cellulosic Fibres (MMCF) Our preferred MMCF comes from supply chains with a low risk of contributing to deforestation and are made using the best manufacturing technologies available. Traceability Traceability is key to identifying risks in our supply chain and to effectively check compliance, achieve our responsibly sourced material targets and reduce our Scope 3 emissions. Implementing full traceability is complex and requires collaboration through the whole supply chain so this year we have continued to develop our strategy and collaborate with our partners. M&S COLLECTION Recycled Thermowarmth™ Quilted Jacket (T495126) £35 1 This data is subject to a discrete assurance process linked to our financing and is scheduled to be published in autumn 2024. Marks and Spencer Group plc Read more on page 22 ESG Report 2024 18",0.1612689020381328
"PERFORMANCE SUMMARY OUR ESG STRATEGY ENVIRONMENT SOCIAL GOVERNANCE ESG DATA RESPONSIBLE SOURCING CONTINUED LOTS TO DO, LOTS OF OPPORTUNITY - FOCUS FOR 2024/25 Going forward we are focusing on including more next-generation fibres in our MMCF mix. Additionally, we continue to work towards getting to 100% responsibly sourced cotton (Better Cotton, organic or recycled-certified) and 100% responsibly sourced polyester (verified recycled) across Clothing & Home. PIONEERING TRACEABIITY WITH Better Cotton Better Cotton is a longstanding M&S partner. We joined as a pioneer member back in 2009 and since then, we have supported Better Cotton's mission to help cotton communities survive and thrive, while protecting and restoring the environment. With over one fifth of the world's cotton now grown under the Better Cotton standard, we believe it is the right time to work with our supply chain to embed traceability requirements in how this cotton is traded within the industry. Since 2021, we have been working with Better Cotton and other brand members through the Traceability Panel, to set up the basis of traceability for Better Cotton. In 2023/24, we ran a pilot in our Indian supply chain to trace Better Cotton from its region of origin up to each stage of its transformation process and into our UK stores. The traceability journey started at the ginner (when cotton fibre is separated from the seeds) close to the fields in Maharashtra; to the northern region of Himachal Pradesh for spinning; garment manufacturing in Delhi; and finally, our stores in the UK. This project gave us invaluable learnings on all suppliers' perspectives and input on how to scale Better Cotton traceability throughout our supply chain, and we have shared our feedback with the Traceability Panel. With this successful first pilot, we are now preparing our supply chain and extending our mapping exercise to facilitate scaling traceable Better Cotton in the future, and progressively onboard more suppliers to this new chain of custody model. Image: M&S Traceable Cotton Blouse TEXTILE Genesis Using Textile Genesis, a new traceability platform that ensures authenticity and provenance of sustainable textiles, we tracked more than 12m garments made of MMCF across our supply chain, from fibre mills up to M&S in 2023/24. We have since increased the scope of sustainable textile traceability to all remaining MMCF, and added recycled polyester and we aim to systematically trace all preferred viscose, lyocell, modal and polyester fibres we source by the end of 2024/25. As well as providing us with full visibility of our supply chain, Textile Genesis allows us to strengthen our compliance checks. Marks and Spencer Group plc ESG Report 2024 19",0.3184562461348176
"PERFORMANCE SUMMARY OUR ESG STRATEGY ENVIRONMENT SOCIAL GOVERNANCE ESG DATA SUSTAINABLE MANUFACTURING In 2023/24, we made great progress in deepening our knowledge of how our supply chain partners make the products we sell. The challenges in reducing their carbon emissions are significant. We are using innovation and the strength of our supply chain partner relationships and collaborations, to provide training and access to decarbonisation programmes. FOOD LOTS DONE - PROGRESS FOR 2023/24 FOOD Manufacture 2030 This year, we started working with Manufacture 2030 to track the progress of our supply chain partners in tackling environmental issues. Manufacture 2030 is a digital collaboration platform that brings together 10 major UK grocery retailers to collect supply chain partners' environmental performance information in one annual survey, giving them access to tools, knowledge and resources that support performance improvements. Through Manufacture 2030, we have better visibility of how our top supply chain partners are meeting our ""six key asks"" on the environment. This includes over 150 suppliers which cover over 50% of our food supplier emissions. C UK grocery retailers partner with Manufacture 2030 - Manufacture 2030 Supporting our supply chain partners In 2023, we held four Supplier Exchange events, bringing together over 100 supply chain partner representatives and providing a forum for peer-to-peer and expert-led knowledge sharing. Recent events focused on environmental risk assessment, product carbon footprinting, renewable energy and sustainable water management. The key purpose of the event is to engage suppliers on the risks and opportunities in relation to FOOTPRINTING OUR PRODUCTS WITH Mondra In 2022/23, we began working with Mondra, an environmental product footprinting platform and Innovate UK grant-funded pilot, to model the carbon footprint of a selected sample of our products and explore opportunities for decarbonisation. We have successfully modelled the carbon footprint of over 5,000 M&S products across the Foodhall, giving us new insights into our GHG emissions at every stage of the supply chain. Going forward, we will trial using this data to inform decision-making at the raw material, product and product-range levels. In parallel, we will work with our supply chain partners to ensure their primary data is as representative as possible, developing a common understanding of the sustainable impact of their products. www.mondra.com/coalition our six key asks and the output is that suppliers have visibility of our plans and expectations for the year ahead. We will continue to target areas where our supply chain partners need the most support. LOTS TO DO, LOTS OF OPPORTUNITY - FOCUS FOR 2024/25 We have learned that most of our supply chain partners have a food waste plan, Scope 1 & 2 emissions targets, commitments around deforestation and conversion-free soy (where relevant), and some renewable energy procurement. However, fewer supply chain partners have Scope 3 emissions targets and our supply chain partners face significant work to achieve our key asks. We are focusing our energy on these areas that are difficult to tackle. OUR SIX KEY ASKS FOR SUPPLIERS 1. Set a science-based, 2040 net zero target and roadmap for Scope 1, 2 and 3 emissions. 2. Purchase 100% renewable electricity. 3. Purchase verified deforestation and conversion-free animal feed. 4. Focus on packaging quality, innovation and sustainability, and remove plastic where possible. 5. Implement a food waste redistribution plan. 6. Implement our Human Rights Standard, including Worker Voice and Human Rights Due Diligence. Marks and Spencer Group plc ESG Report 2024 20",0.11842434526258054
"OUR ESG STRATEGY ENVIRONMENT SOCIAL PERFORMANCE SUMMARY SUSTAINABLE MANUFACTURING CONTINUED TARGETS C&H MANUFACTURING EMISSIONS REDUCTION Target 50% of invited suppliers verify their Higg FEM (Facility Environmental Module) 2022. NET ZERO 2023/24 progress 77% of supply chain partners verified their assessment at Tier 1 2023/24 progress To drive supply chain decarbonisation, we collaborate with other brands and industry partners as members of Cascale (formerly the Sustainable Apparel Coalition). We are driving adoption of the Higg Index, the sustainability assessment tool that standardises how our suppliers measure and evaluate the environmental performance of their facilities. The Higg FEM is the cornerstone of our supplier programme. This annual assessment collects primary supplier data to paint a clear picture of a facility's environmental impacts. Every stage of the production process is captured through this tool - from water use to waste management, to chemical and energy use, which we can then use to identify emissions hotspots, develop insights into the environmental performance of our suppliers and prioritise actions to contribute to our net zero targets. 86% of supply chain partners verified their assessment at Tier 2 CLOTHING & HOME C&H LOTS DONE - PROGRESS FOR 2023/24 The manufacture of products and materials by our suppliers produces around half of our Clothing & Home product emissions. See chart on page 12. Fabric dyeing and finishing (Tier 2) is an emissions hotspot, as our suppliers' factory processes are energy and heat intensive, using a mix of fuel sources to generate direct heat and steam. GOVERNANCE Over the past five years, we have deployed the Higg FEM across our supply chain. In 2023, we invited our top 94% (by cost value) of suppliers at Tier 1, and all our mills at Tier 2, to complete the module. We encourage verification of the module to allow us to obtain assured data, and have achieved verification levels of 77% at Tier 1 and 86% at Tier 2. ESG DATA In 2024, we published a new version of our Environment and Chemical Policy (ECP), which summarises the environmental compliance requirements of our supplier facilities. The guidance in our updated ECP fully aligns with the structure of the Higg FEM and Zero Discharge of Hazardous Chemicals (ZDHC) guidelines and explains minimum expectations and best practices across our environmental metrics. For more details about our responsible chemical management strategy, visit our website SUPPLY CHAIN PARTNER FACILITIES COMPLETING HIGG FEM Self-assessed · Verified Tier 1: Finished product facilities 344 286 48 143 108 103 112 105 2020 2021 2022 2023 Tier 2: Material producers 358 226 15 65 5 18 2020 2021 56 37 2022 2023 SUPPLY CHAIN PARTNER FACILITIES COMPLETING HIGG FEM VERIFICATION (%) Tier 1: Finished product facilities Tier 2: Material producers 2020 31% 2021 58% 2022 72% 2023 77% 2020 75% 2021 78% 2022 86% 2023 86% Marks and Spencer Group plc ESG Report 2024 21",0.16266835016835018
"PERFORMANCE SUMMARY OUR ESG STRATEGY GOVERNANCE ESG DATA ENVIRONMENT SOCIAL SUSTAINABLE MANUFACTURING CONTINUED In 2023/24, we focused on improving our understanding of assessment metrics among our suppliers through training and engagement. We provided in-person training for over 350 facilities in five of our main manufacturing countries. Our regional sustainability teams also engaged directly with key supply chain partners to evaluate their responses, check data accuracy and use the assessment insights to develop facility improvement plans. LOTS TO DO, LOTS OF OPPORTUNITY - FOCUS FOR 2024/25 This year, our focus is to use the data we are receiving through the Higg FEM to work with suppliers on action plans so they can progress towards their reduction targets. We will engage more suppliers with the Apparel Impact Institute's (Aii) Carbon Leadership Programme. REDUCING SUPPLIER emissions Access to Apparel Impact Institute's (Aii) Carbon Leadership Programme is a key part of our supplier engagement, focused on high-volume facilities. The programme can help deliver an average 30% reduction in facility emissions on completion. The programme involves an in-depth carbon assessment, identifying carbon reduction opportunities and undertaking carbon reduction target setting. An action plan will focus on applying technical solutions to accelerate decarbonisation through engineering works, which improve energy efficiency, reduce heat loss and promote heat recovery. Supply chain partners will also gain a better understanding of where it is feasible to convert to lower carbon fuels and access renewable energy. 50 of our top volume fabric suppliers are already engaged and benefitting from this programme. UPSKILLING COLLEAGUES THROUGH OUR Sustainability Academy The Sustainability Academy is a training programme aimed at improving Clothing & Home colleagues' understanding of M&S sustainability goals and ethical trade standards. This provides a deeper understanding of the context beyond our policies. It equips colleagues with the knowledge and tools needed to improve engagement internally and support their decision- making process. This includes offering an in-depth session on: - An introduction into circular design, standards and certification. - Sustainable manufacturing and the environmental impacts of manufacturing textiles (in particular supporting suppliers to help them reduce emissions and improve on chemical management). - Ethical trade modules outlining the Universal Declaration of Human Rights and M&S' approach to responsible sourcing (including policies, factory auditing, monitoring and worker impact programmes). - Our core raw materials (cotton, polyester and MMCF, animal-derived fibres). This year, 133 colleagues from across our product teams attended the training. M Marks and Spencer Group plc ESG Report 2024 22",0.12551892551892554
